2,https://gradaustralia.com.au/kpmg-summer-vacation-internship-program,KPMG Summer Vacation Internship Program,Vacation Students Go Beyond Your Potential Get on site experience with leading Australian organisations Work on challenging projects from day one Immerse yourself in an inclusive diverse and supportive culture KPMG is one of the most trusted and respected global professional services firms with over 162 000 people in more than 155 countries. As a leading provider of advisory audit and tax services we help organisations build protect and realise value in dynamic and challenging business environments. We also support numerous organisations in the areas of education social inclusion health and the environment working on initiatives that make a genuine difference to our society. Our purpose is to inspire confidence and empower change and to be the clear choice for our people clients and the public. The opportunity Working in Advisory Audit Assurance Tax or Private Enterprise you ll be mixing with some of the brightest minds while working on significant commercial projects with some of the nation s most respected companies. You ll also have the opportunity to network with sector and technical experts across our business. What you bring Our standards are high but we re interested in more than academic qualifications. We welcome different backgrounds value all experiences and fields of study. We re looking for talented people team players and progressive thinkers who can communicate their ideas convincingly. You will Have a questioning mind and lots of bright ideas Be a critical thinker with strong analytical and problem solving skills Demonstrate good teamwork and leadership potential Be adaptable to new technologies and systems Have strong business and commercial acumen Be passionate about delivering high quality work What we offer you You ll work in collaborative culture that focuses on the wellbeing of our people to drive innovation. Our flexible and agile work environment fosters an open friendly and supportive environment. We believe diversity of thought background and experience strengthens relationships and delivers meaningful benefits to our people our clients and community. We are consistently recognised as an employer of choice for women and our inclusive culture promotes the development of our people irrespective of gender ethnicity generation flexible work status family circumstances sexual orientation or disability. If you are looking for a vacation experience that will take you further talk to us first at KPMG. ,"Monday, July 11, 2016","Sunday, August 28, 2016",Specific date,,65 - 74% WAM (Credit),Internships,https://home.kpmg.com/au/en/home/careers/graduates.html,,2016-08-22 04:12:42
3,https://gradaustralia.com.au/nsw-treasury-fast-track-graduate-accounting-program-2017-sydney,NSW Treasury Fast Track Graduate Accounting Program 2017 - Sydney,Join us in building a WORLD CLASS TREASURY 3 year rotational program with an ongoing role at the conclusion of the program Work across multiple government agencies focused on building financial capability Accelerated career development focused on achieving your CA or CPA Qualification Treasury NSW is committed to increasing financial capability across the sector enabling Government to deliver its promises to the people of New South Wales whilst living out our values of Excellence in Service Integrity Accountability and Trust. We are committed to a better tomorrow promoting mobility and diversity whilst retaining high calibre and ambitious graduates who are valued in a high performance culture. Do you want to be inspired and challenged We are seeking candidates who are tertiary qualified and eligible to commence their Chartered Accounting CA or Certified Practicing Accountants Australia CPA qualifications. What’s on offer A chance to gain exposure and experience to work across the entire NSW Government sector Gain experience by assisting with monthly reporting the preparation of the annual financial statement and have exposure to a range of financial management practices and processes Utilise your analytical skills to recognise trends in data and support in the provision of financial management with decision making on numerous issues that affect the finances and economy of NSW Contribute to the development and management of various Government projects by connecting and engaging with a diverse range of stakeholders and advising on critical activities In each rotation you will be surrounded by a committed team to support your growth and development as you progress through the Program This is an exciting opportunity to grow with us in building a WORLD CLASS TREASURY You will be rewarded through working in a flexible working environment located within the Sydney Metropolitan region and the opportunity to have a regional placement. Your remuneration package will include salary 79 384 87 591 employer’s contribution to superannuation and leave loading plus full payment of your professional qualification fees. To apply please review the role description and tailor a cover letter and resume to the focus capabilities maximum 4 pages . For more information on the Treasury Graduate Program please join us at our information night on Wednesday 10th August from 6pm 7 30pm. For more information click our Event Page registrations close on 5th August 2016. ,,"Sunday, August 28, 2016",,,,Graduate Jobs,http://iworkfor.nsw.gov.au/job/fast-track-graduate-accounting-program-2017-38731,['Sydney'],2016-08-22 04:12:44
4,https://gradaustralia.com.au/nsw-treasury-graduate-program-2017,NSW Treasury Graduate Program 2017 ,Join us in building a WORLD CLASS TREASURY 12 month rotational program with an ongoing role at the conclusion of the program Multiple opportunities to participate in cross sector projects working within a central agency Strong development program focused on behavioural and technical skills Treasury NSW is committed to enabling Government to deliver its promises to the people of New South Wales whilst living out our values of Excellence in Service Integrity Accountability and Trust. We are committed to a better tomorrow promoting mobility diversity and efficiency where people are valued in a high performance culture. Our Graduate Program includes a targeted position for a person of Aboriginal or Torres Strait Islander descent. Do you want to be inspired and grow We are seeking candidates who are tertiary qualified in business commerce accounting finance economics or legal backgrounds and have graduated within the past three years. What’s on Offer Undertake analysis of the financial position of Government agencies and businesses whilst being exposed to developing implementing the Governments economic and fiscal policies Gain valuable experience across three different areas including government transactions budget strategy economic policy and fostering relationship with line agencies Utilise your analytical and problem solving skills as you interact with a diverse group of people as you work on challenging and stimulating projects You will be instrumental in embedding our new financial management framework and system to deliver the 2017 18 state budget through engagement within line agencies You will be surrounded by a committed team to support your growth and development as you progress through the program undertaking a tailored learning development program This is a fantastic opportunity to grow with us in building a WORLD CLASS TREASURY You will be rewarded through working in a flexible working environment located within Martin Place Sydney. Your remuneration package will include salary 60 154 65 396 employer’s contribution to superannuation and leave loading To apply please review the role description and tailor a cover letter and resume to the focus capabilities maximum 4 pages . For more information on the Treasury Graduate Program please join us at our information night on Wednesday 10th August from 6pm 7 30pm. For more information click our Event Page registrations close on 5th August 2016. ,,"Sunday, August 28, 2016",,,,Graduate Jobs,http://iworkfor.nsw.gov.au/job/nsw-treasury-graduate-program-2017-38736,['Sydney'],2016-08-22 04:12:45
5,https://gradaustralia.com.au/orica-2017-supply-chain-graduate-position,Orica 2017 Supply Chain Graduate Position ,Applications for Orica’s 2017 Supply Chain Graduate Program in Australia are now open. At Orica our Supply Chain Graduate Program is the key entry point for young professionals to enter our leadership pipeline. We are serious about your development and invest in a three year rotational program to give you the hands on experience you want with the responsibility you ve earned. Diverse job rotations every 12 months offering you real opportunities and real responsibility An opportunity to experience living across different parts of Australia A program designed to develop your leadership potential About Orica An Australian mining services company with global operations Orica has a diverse workforce of over 12 000 people servicing customers across more than 100 countries. We are the largest provider of commercial explosives and blasting systems to the mining quarrying oil and gas and construction markets a global leader in the provision of ground support in mining and tunnelling and a leading supplier of sodium cyanide for gold extraction. The Program Satisfy your desire for diversity of work travel and development on Orica s Global Graduate Program Diverse rotations across different parts of the business Face to face graduate development workshops each year with a focus on preparing you for operating and leading in a global environment Structured networking opportunities with Orica s senior leadership teams An assigned Mentor for career guidance support and advice A nominated graduate Buddy in your first year for peer to peer support Involvement in local community projects volunteering and the option to be involved in our Graduate Sustainability Committee A graduate peer community one that lasts a lifetime For our 2017 Supply Chain Graduate Progam Orica will be hiring graduates with the following degrees backgrounds Business Commerce Supply Logistics Marketing Eligibility Be an Australian or New Zealand citizen OR have Australian Permanent Residency Have a minimum average GPA of 65 Must be mobile and willing to relocate for each rotation Fluent written and spoken English Be willing to undergo a medical and drug screen Be living in Australia and able to attend selection stages in person if required To make an application please click the apply now button below. Applications close Sunday 28 August 2016 at midnight. ,"Thursday, August 4, 2016","Sunday, August 28, 2016",Specific date,,65 - 74% WAM (Credit),Graduate Jobs,https://secure.dc2.pageuppeople.com/apply/582/gateway/Default.aspx?c=apply&sJobIDs=829103&SourceTypeID=1166&sLanguage=en&lApplicationSubSourceID=15670,['Positions Australia wide '],2016-08-22 04:12:47
6,https://gradaustralia.com.au/general-electric-financial-management-program-fmp-graduate-january-2017,General Electric Financial Management Program (FMP) - Graduate - January 2017,GE are excited to announce the opportunity for Graduates to join our Financial Management Program FMP in January 2017 in our Melbourne Sydney or Perth offices. The FMP is an intensive two year entry level program spanning four rotational assignments across Australia and New Zealand. Essential Responsibilities This is a dynamic program that develops leadership and analytical skills through a combination of on the job and classroom training and formal finance and leadership course work. Hands on experience may include financial planning and analysis controllership accounting auditing commercial finance pricing and treasury. The FMP provides 4 x 6 month rotation assignments across Australia and New Zealand. Completion of formal finance and leadership coursework. Regular opportunities to pitch out to senior stakeholders. Exclusive roundtable events with GE s worldwide business leaders. Buddy and Mentor Program. Mid rotation and end of rotation appraisals. Job shadowing program. Residential development days over the 2 year program. Opportunities to enter GE s Corporate Audit Staff CAS a career accelerator leadership program. Qualifications Requirements Bachelor s degree Majors in Finance and or Accounting highly regarded but not essential . Graduate in 2016 or have graduated within the last 2 years. Achieved academic excellence. Hold the appropriate entitlement to work in Australia New Zealand at date of application Permanent Resident of Australia or an Australian Citizen or New Zealand Citizen . Available to start with GE in January 2017 Demonstrated leadership ability initiative and autonomy. Geographic mobility in accepting rotational assignments. FMPs may be required to complete rotations in the following locations Perth Brisbane Melbourne Sydney Adelaide and Auckland. Desired Characteristic Prior summer vacation intern co op cadet or work experience in a financial field. A passion to pursue a career in Corporate Finance and or Accounting. Microsoft Excel skills. Excellent communication skills. If you believe you possess these qualities then we want to hear from you. We believe the more we show you today the more we may be able to learn from you tomorrow. Our bright futures may well intertwine. Applications close 5pm AEST Friday 31st August 2016 Resume and Cover Letter need to be attached for applications to be considered complete. ,"Wednesday, June 29, 2016","Wednesday, August 31, 2016",Specific date,Bachelor degree,,Graduate Jobs,https://xjobs.brassring.com/tgwebhost/jobdetails.aspx?partnerid=54&siteid=5346&jobid=1315394,"['North Sydney', 'Jandakot', 'Melbourne']",2016-08-22 04:12:49
7,https://gradaustralia.com.au/general-electric-summer-internship-financial-management-program-201617,General Electric Summer Internship - Financial Management Program - 2016/17,GE is pleased to offer selected students the opportunity to join our business for a FMP Summer Internship. Students will be exposed to GE’s diverse portfolio of businesses which provides a perfect opportunity for us to learn about you and your interests and for you to learn about GE and a career with us. Essential Responsibilities We are looking for penultimate university students to join us for 12 weeks commencing in December 2016. The program will give FMP interns the opportunity to gain hands on practical experience and further their development across a wide range of challenging projects to build a stronger finance and leadership skills set. Possible exposure as an intern may include Commercial Finance Operations Analysis Auditing Forecasting Pricing and Treasury Productivity Cash Management Financial Planning Controllership Accounting The internship will provide Opportunities to pitch out to senior stakeholders Exclusive roundtable events with GE’s business leaders Buddy and Mentorship Program Ongoing feedback formal appraisals Job shadowing opportunities Qualifications Requirements To be considered for our FMP Internship we’re looking for students who Have demonstrated leadership ability initiative and autonomy Are in their penultimate or final year of a Bachelor degree Major in Finance and or Accounting highly regarded but not essential Have achieved academic excellence Are interested in a career in Finance and or Accounting Hold the appropriate entitlement to work in Australia New Zealand at date of application Permanent Resident of Australia or an Australian Citizen or New Zealand Citizen . Available to start with GE in December 2016 Demonstrated leadership ability initiative and autonomy. Geographic mobility. FMP Interns may be required to be based in the following locations Perth Brisbane Melbourne Sydney Adelaide and Auckland. Desired Characteristics If you believe you possess these qualities then we want to hear from you. We believe the more we show you today the more we may be able to learn from you tomorrow. Our bright futures may well intertwine. Applications close 5pm AEST Friday 31st August 2016 Resume and Cover Letter need to be attached for applications to be considered complete. ,"Wednesday, June 29, 2016","Wednesday, August 31, 2016",,,,Internships,https://xjobs.brassring.com/tgwebhost/jobdetails.aspx?partnerid=54&siteid=5346&jobid=1318883,"['North Sydney', 'Jandakot', 'Melbourne', 'Parramatta']",2016-08-22 04:12:50
8,https://gradaustralia.com.au/leidos-internship-melbourne,Leidos Internship Melbourne,Internship positions are available to work in application or product development. Applications development frequently involves dynamic XML based websites while product development has a stronger focus on API development data structures and algorithms. Duties include requirements discovery design programming testing and documentation. The work is often challenging and requires motivated individuals to work independently with moderate supervision and appropriate training. Essential Attributes Strong software engineering skills. Self motivated and able to work independently. Works effectively in teams. Able to learn and apply new tools and technologies. Desirable Attributes Java C Javascript or other programming languages. Windows and Unix Linux experience. Good understanding of web development. Knowledge of document markup standards such as XML SGML XPath XSL XSLT and HTML. Understanding of text retrieval and document management technologies. Excellent academic results. Please note that due to the nature of the client successful inters must be Australian Citizens and be willing to undertake a vetting process to gain an Australian Government Security Clearance. ,"Monday, August 1, 2016","Wednesday, August 31, 2016",Specific date,Bachelor degree,65 - 74% WAM (Credit),Internships,https://www.leidos.com/about/companies/leidos-australia-leidos-pty-ltd,['Melbourne'],2016-08-22 04:12:52
9,https://gradaustralia.com.au/kordamentha-20162017-real-estate-vacation-program-melbourne,KordaMentha 2016/2017  Real Estate - Vacation Program Melbourne,KordaMentha is an advisory and investment firm that provides Real Estate Investment Management Restructuring Turnaround and Forensic support for companies. With offices in Australia New Zealand and Singapore and an international network in cooperation with AlixPartners we have managed some of the most complex assignments in Australia and abroad. We have a reputation for delivering quality solutions to improve business and investment performance. We have a strong team culture and provide a stimulating and flexible work environment. KordaMentha Real Estate is Australia s preeminent real estate workout and advisory group having managed some of the country s largest and most complex real estate projects over the past decade. The KordaMentha Real Estate team includes development and construction managers licensed real estate agents sales and marketing specialists transaction managers valuers asset managers financial analysts and contracts administrators. With a unique set of real estate capabilities the group regularly provide expert advice to clients relating to the development management and sale of real estate projects. The Role KordaMentha Real Estate is offering a paid vacation employment program for final year students to gain practical and valuable work experience with its Melbourne team. One successful vacationer may be offered a full time graduate position within the Real Estate practice commencing in February 2017. As a Vacationer you will gain exposure to our Real Estate practice and will have the opportunity to work on some high profile engagements whilst receiving mentoring from our senior staff as well as being supported by a recent graduate buddy . The Vacation Program runs for a period of 4 weeks on a part time basis 3 days per week and is open to students in their final year of university. It provides first hand experience of what it s like to work at KordaMentha and opportunities to work on interesting engagements. Some of the tasks that the successful applicant may complete day to day include Liaising with various property professionals including selling agents property managers and valuers Assisting with the management of real estate transactions Assisting in the management and coordination of contractors suppliers and consultants to progress real estate engagements Residential and commercial property research and analysis of economic and market trends The successful applicant will have the opportunity to work within our Real Estate team and gain exposure to a wide range of asset types engagements and clients. Benefits Some of the benefits for KordaMentha vacationers include Valuable hands on experience Networking opportunities prior to completing your university degree Exposure to clients including local and international banks and top tier law firms Supportive team environment Inductions to understand the business Buddy program Active social culture Open door policy Application Process Requirements To be eligible to apply for this role you must Be an Australian citizen or permanent resident at the time of application Be in your final year of or recently completed a Property related degree You may have some experience in valuations agency property development or another property stream. Be available to work for a minimum four week period between late September 2016 and late November 2016. We are a client focused firm so in addition to your academic results we consider your personal qualities characteristics and interests. We look for well rounded candidates who may have some prior work experience. For more information and to apply please visit our website. Applications close 1 September 2016 ,"Monday, July 18, 2016","Thursday, September 1, 2016",Specific date,Bachelor degree,,Internships,http://kordamentha.com/gradcareers?utm_source=Grad%20Australia&utm_medium=Grad%20portal&utm_campaign=Grad%20Campaign,['Melbourne'],2016-08-22 04:12:53
10,https://gradaustralia.com.au/deloitte-graduate-program-canberra-perth,Deloitte Graduate Program - Canberra & Perth ,Our people are our most valuable assets. Each year we recruit a large number of outstanding graduates for our in demand Graduate Program to inject new ideas and energy into Deloitte. We provide the right kinds of tools and training to ensure all our graduates can achieve career success through mentoring peer support and e learning. As a full time career opportunity we look forward to helping you find your fit at Deloitte ,"Tuesday, July 19, 2016","Saturday, September 3, 2016",,,,Graduate Jobs,http://yourfuture.deloitte.com.au/site/landing,[' Canberra & Perth '],2016-08-22 04:12:55
11,https://gradaustralia.com.au/deloitte-graduate-program-sydney-perth-alice-springsdarwin-melbourne-brisbane-hobartlaunceston,"Deloitte Graduate Program - Sydney, Perth, Alice Springs/Darwin, Melbourne, Brisbane & Hobart/Launceston",Our people are our most valuable assets. Each year we recruit a large number of outstanding graduates for our in demand Graduate Program to inject new ideas and energy into Deloitte. We provide the right kinds of tools and training to ensure all our graduates can achieve career success through mentoring peer support and e learning. As a full time career opportunity we look forward to helping you find your fit at Deloitte ,"Tuesday, July 19, 2016","Saturday, September 3, 2016",,,,Graduate Jobs,http://yourfuture.deloitte.com.au/site/landing,"['Sydney', 'Melbourne', 'Brisbane', 'Perth', 'Alice Springs/Darwin & Hobart/Launceston']",2016-08-22 04:12:57
12,https://gradaustralia.com.au/deloitte-summer-vacation-program-sydney-perth-alice-springsdarwin-melbourne-brisbane,"Deloitte Summer Vacation Program – Sydney, Perth, Alice Springs/Darwin, Melbourne, Brisbane & Hobart/Launceston",Your career is unique just like you. That’s why we don’t want to give you generic information about your career at Deloitte. Click through to our careers site and tell us a little bit about yourself to receive customised career content just for you. What are you waiting for ,"Tuesday, July 19, 2016","Saturday, September 3, 2016",,,,Internships,http://yourfuture.deloitte.com.au/site/landing,"['Sydney', 'Melbourne', 'Brisbane', 'Perth', 'Alice Springs/Darwin', '& Hobart/Launceston']",2016-08-22 04:12:58
13,https://gradaustralia.com.au/deloitte-summer-vacation-program-canberra,Deloitte Summer Vacation Program – Canberra ,Your career is unique just like you. That’s why we don’t want to give you generic information about your career at Deloitte. Click through to our careers site and tell us a little bit about yourself to receive customised career content just for you. What are you waiting for ,"Tuesday, July 19, 2016","Saturday, September 3, 2016",,,,Internships,http://yourfuture.deloitte.com.au,['Adelaide & Canberra'],2016-08-22 04:13:00
